{
  "schema_version": "1.0.0",
  "catalog_phase": "Phase 2 - Core evidence sources, gaps closed against Microsoft Learn",
  "notes": "Single source of truth for Poster 1, Poster 2 and the interactive site. Every URL is referenced by source id (data/sources.json). An entry is 'Verified' only when verification.gaps is empty; 'Conditional' entries list exactly what is still unconfirmed.",
  "entries": [
    {
      "id": "entra-audit-logs",
      "priority": "Core",
      "evidence_plane": "Identity",
      "product_id": "entra-id",
      "evidence_source": "Audit logs",
      "evidence_type": "Audit",
      "description": "Directory audit trail of tasks performed in the tenant by users, applications, and services, including changes to users, groups, applications, licenses, and other directory objects.",
      "evidence_doc_source_id": "src-entra-audit-logs-concept",
      "availability": "Automatic with limited native retention",
      "availability_flags": ["AUTO", "LICENSE", "EXPORT"],
      "configuration_required": false,
      "configuration_notes": "Generated without configuration. Routing to a Log Analytics workspace, Azure Storage account, or Event Hubs requires a Microsoft Entra diagnostic setting; Security Administrator is the least-privileged role to configure one.",
      "licensing_dependency": "Native retention is 7 days with Microsoft Entra ID Free and 30 days with P1 or P2. Audit logs are available for the features the tenant has licensed.",
      "deployment_dependency": null,
      "where_to_investigate": "Microsoft Entra admin center; Microsoft Graph audit logs API; Log Analytics (AuditLogs) when routed by a diagnostic setting.",
      "portal_path": "Microsoft Entra admin center > Entra ID > Monitoring & health",
      "preservation_options": [
        "Microsoft Entra diagnostic setting to a Log Analytics workspace",
        "Microsoft Entra diagnostic setting to an Azure Storage account (archive)",
        "Microsoft Entra diagnostic setting to Event Hubs",
        "Microsoft Purview Audit (Premium) retention for Microsoft Entra audit records (E5-class or Purview Suite licensing)",
        "Download from the portal as CSV or JSON"
      ],
      "native_retention": "7 days (Microsoft Entra ID Free); 30 days (Microsoft Entra ID P1 or P2)",
      "retention_notes": "Retention changes are not retroactive: after an upgrade from Free to P1 or P2, only data still inside the 7-day window is available. Retention at a routed destination is governed by that destination.",
      "diagnostic_setting_applicable": true,
      "log_analytics_mode": "Fixed table",
      "log_analytics_tables": [
        { "table": "AuditLogs", "mode": "Fixed table", "verified": true, "source_ids": ["src-la-table-auditlogs", "src-entra-diag-log-options"], "notes": null }
      ],
      "investigation_relevance": [
        "Who granted a user membership in an administrative group, and when",
        "What changes were made to an application or service principal",
        "How many password resets were made in a period",
        "What operations a specific agent identity performed"
      ],
      "relevance_tags": ["Identity and access", "Directory and configuration changes"],
      "powershell": {
        "supported": true,
        "acquisition_type": "Microsoft Graph PowerShell",
        "modules": ["Microsoft.Graph.Reports"],
        "commands": [
          {
            "id": "entra-audit-connect",
            "command": "Connect-MgGraph",
            "interface": "Microsoft Graph PowerShell",
            "example": "Connect-MgGraph -Scopes \"AuditLog.Read.All\",\"Directory.Read.All\"",
            "purpose": "Authenticate with the permissions needed to read activity logs.",
            "role": "Authenticates session",
            "api_status": "Current",
            "pagination": "Not applicable",
            "verified": true,
            "source_ids": ["src-entra-ca-applied", "src-entra-graph-analyze"],
            "notes": "Add Policy.Read.ConditionalAccess when Conditional Access details are needed."
          },
          {
            "id": "entra-audit-get",
            "command": "Get-MgAuditLogDirectoryAudit",
            "interface": "Microsoft.Graph.Reports",
            "example": "Get-MgAuditLogDirectoryAudit -Filter \"activityDateTime ge 2026-10-01T00:00:00Z and activityDateTime le 2026-10-07T23:59:59Z\" -All",
            "purpose": "Retrieve directory audit records.",
            "role": "Acquires evidence",
            "api_status": "GA",
            "pagination": "-All follows every page; -Top and -PageSize bound the result. activityDateTime supports eq, ge, and le in $filter, and $orderby.",
            "verified": true,
            "source_ids": ["src-ps-get-mgauditlogdirectoryaudit", "src-graph-directoryaudit-resource", "src-entra-graph-analyze"],
            "notes": "Other documented filters: activityDisplayName (eq, startswith), correlationId (eq), loggedByService (eq), initiatedBy/user/id, initiatedBy/user/userPrincipalName, and initiatedBy/app/appId."
          }
        ]
      },
      "api": {
        "supported": true,
        "name": "Microsoft Graph (audit logs API)",
        "endpoint": "GET /auditLogs/directoryAudits",
        "status": "GA",
        "source_ids": ["src-graph-directoryaudit-list", "src-graph-auditlog-overview"],
        "notes": "Available in the global service and national clouds. Custom security attribute audit logs and provisioning logs are available only on the beta endpoint."
      },
      "required_permissions": [
        { "context": "Microsoft Graph (application)", "value": "AuditLog.Read.All (least privileged); Directory.Read.All (higher privileged)", "verified": true, "source_ids": ["src-graph-directoryaudit-list", "src-entra-graph-analyze"] },
        { "context": "Microsoft Graph (delegated)", "value": "AuditLog.Read.All (least privileged); Directory.Read.All (higher privileged)", "verified": true, "source_ids": ["src-graph-directoryaudit-list"] },
        { "context": "Microsoft Entra role", "value": "Reports Reader (least privileged), Security Reader, or Security Administrator to read audit logs", "verified": true, "source_ids": ["src-graph-directoryaudit-list", "src-entra-access-activity-logs"] },
        { "context": "Microsoft Entra role", "value": "Attribute Log Reader or Attribute Log Administrator for custom security attribute audit logs", "verified": true, "source_ids": ["src-entra-audit-logs-concept"] },
        { "context": "Microsoft Entra role", "value": "Security Administrator (least privileged to configure Microsoft Entra diagnostic settings)", "verified": true, "source_ids": ["src-entra-access-activity-logs"] }
      ],
      "output_formats": ["JSON", "CSV"],
      "limitations": [
        "Native retention is 7 or 30 days. Without a diagnostic setting in place before the incident, older records cannot be recovered.",
        "Custom security attribute audit logs and provisioning logs are only on the Microsoft Graph beta endpoint.",
        "Audit logs are available only for features the tenant has licensed.",
        "The IP address in an audit record is the OAuth client's IP address (the TCP peer of the service endpoint), not necessarily the end user's device."
      ],
      "kql_examples": [
        {
          "title": "Coverage check: oldest and newest AuditLogs records in the workspace",
          "query": "AuditLogs\n| where TimeGenerated > ago(3653d)\n| summarize OldestAuditEvent=min(TimeGenerated), NewestAuditEvent=max(TimeGenerated) by Type",
          "tables": ["AuditLogs"],
          "verified": true,
          "source_ids": ["src-entitlement-logs-reporting"]
        }
      ],
      "publication": { "poster_1": true, "poster_2": true, "site": true },
      "replaced_by": null,
      "verification": {
        "status": "Verified",
        "last_verified": "2026-10-13",
        "gaps": [],
        "source_ids": ["src-entra-what-is", "src-entra-audit-logs-concept", "src-entra-monitoring-overview", "src-entra-retention", "src-entra-access-activity-logs", "src-graph-auditlog-overview", "src-entra-secops-guide", "src-graph-directoryaudit-list", "src-graph-directoryaudit-resource", "src-ps-get-mgauditlogdirectoryaudit"]
      },
      "notes": null
    },
    {
      "id": "entra-sign-in-logs",
      "priority": "Core",
      "evidence_plane": "Identity",
      "product_id": "entra-id",
      "evidence_source": "Sign-in logs",
      "evidence_type": "Sign-in",
      "description": "Records of sign-in attempts by users and client applications, split into four types: interactive user, non-interactive user, service principal, and managed identity sign-ins. Each record includes status, client, application, location, and Conditional Access details.",
      "evidence_doc_source_id": "src-entra-sign-ins-concept",
      "availability": "Automatic with limited native retention",
      "availability_flags": ["AUTO", "LICENSE", "EXPORT"],
      "configuration_required": false,
      "configuration_notes": "Generated without configuration. Each sign-in type is a separate diagnostic-setting category (SignInLogs, NonInteractiveUserSignInLogs, ServicePrincipalSignInLogs, ManagedIdentitySignInLogs); each one must be selected to be routed.",
      "licensing_dependency": "Native retention is 7 days with Microsoft Entra ID Free and 30 days with P1 or P2. Querying sign-ins through Microsoft Graph requires a Microsoft Entra ID P1 or P2 license on the tenant.",
      "deployment_dependency": null,
      "where_to_investigate": "Microsoft Entra admin center; Microsoft Graph /auditLogs/signIns; Log Analytics sign-in tables when routed.",
      "portal_path": "Microsoft Entra admin center > Entra ID > Monitoring & health > Sign-in logs",
      "preservation_options": [
        "Microsoft Entra diagnostic setting to a Log Analytics workspace (select each sign-in category)",
        "Microsoft Entra diagnostic setting to an Azure Storage account (archive)",